{
 "$schema":"https://json-schema.org/draft/2020-12/schema",
 "$id":"urn:selfone:finance:import-event:1",
 "type":"object","additionalProperties":false,
 "required":["schema_version","event_id","event_type","connection_id","provider","provider_message_id","received_at","document"],
 "properties":{
  "schema_version":{"const":"1"},"event_type":{"const":"finance.document.received"},
  "event_id":{"type":"string","format":"uuid"},"connection_id":{"type":"string","format":"uuid"},
  "provider":{"type":"string","minLength":1,"maxLength":64},
  "provider_message_id":{"type":"string","minLength":1,"maxLength":512},
  "received_at":{"type":"string","format":"date-time"},
  "document":{"type":"object","additionalProperties":false,"required":["kind","content_sha256","text"],"properties":{
   "kind":{"type":"string","minLength":1},"content_sha256":{"type":"string","pattern":"^[a-f0-9]{64}$"},
   "text":{"type":"string","minLength":1},"storage_ref":{"type":"null"},"metadata":{"type":["object","null"]}
  }}
 }
}
